<?xml version="1.0" encoding="UTF-8"?>
<list enabled="true" xmlns:xsi="http://www.w3.org/2001/XMLSchema-instance" xsi:noNamespaceSchemaLocation="zones.xsd">
	<!-- H5 Olympiad Stadium Zones -->
	<zone name="Grassy Arena" type="OlympiadStadiumZone" shape="Cylinder" minZ="-3351" maxZ="1149" rad="2000">
		<node X="-88082" Y="-252843" />
		<!-- point1 -->
		<spawn X="-89485" Y="-252843" Z="-3341" />
		<spawn X="-89500" Y="-252843" Z="-3341" />
		<spawn X="-89515" Y="-252843" Z="-3341" />
		<!-- point2 -->
		<spawn X="-86678" Y="-252843" Z="-3341" />
		<spawn X="-86663" Y="-252843" Z="-3341" />
		<spawn X="-86648" Y="-252843" Z="-3341" />
	</zone>
	<zone name="Three Bridges Arena" type="OlympiadStadiumZone" shape="Cylinder" minZ="-7751" maxZ="-3251" rad="2000">
		<node X="-75465" Y="-252461" />
		<!-- point1 -->
		<spawn X="-76845" Y="-252461" Z="-7741" />
		<spawn X="-76860" Y="-252461" Z="-7741" />
		<spawn X="-76875" Y="-252461" Z="-7741" />
		<!-- point2 -->
		<spawn X="-74085" Y="-252461" Z="-7741" />
		<spawn X="-74070" Y="-252461" Z="-7741" />
		<spawn X="-74055" Y="-252461" Z="-7741" />
	</zone>
	<zone name="Heros's Vestiges Arena" type="OlympiadStadiumZone" shape="Cylinder" minZ="-8485" maxZ="-3985" rad="2000">
		<node X="-88095" Y="-239351" />
		<!-- point1 -->
		<spawn X="-89277" Y="-239351" Z="-8475" />
		<spawn X="-89292" Y="-239351" Z="-8475" />
		<spawn X="-89307" Y="-239351" Z="-8475" />
		<!-- point2 -->
		<spawn X="-86913" Y="-239351" Z="-8475" />
		<spawn X="-86898" Y="-239351" Z="-8475" />
		<spawn X="-86883" Y="-239351" Z="-8475" />
	</zone>
	<zone name="Orbis Arena" type="OlympiadStadiumZone" shape="Cylinder" minZ="-8228" maxZ="-3728" rad="2000">
		<node X="-75457" Y="-239182" />
		<!-- point1 -->
		<spawn X="-76460" Y="-239182" Z="-8218" />
		<spawn X="-76475" Y="-239182" Z="-8218" />
		<spawn X="-76490" Y="-239182" Z="-8218" />
		<!-- point2 -->
		<spawn X="-74173" Y="-239182" Z="-8218" />
		<spawn X="-74158" Y="-239182" Z="-8218" />
		<spawn X="-74143" Y="-239182" Z="-8218" />
	</zone>
</list>